### /dev/disk/by-id/ata-P3-256_9760522200232
DEVTYPE=disk
ID_MODEL=P3-256
ID_SERIAL=P3-256_9760522200232
smartctl 7.5 2025-04-30 r5714 [x86_64-linux-7.0.14-8-pve] (local build)
Copyright (C) 2002-25, Bruce Allen, Christian Franke, www.smartmontools.org

=== START OF INFORMATION SECTION ===
Device Model:     P3-256
Serial Number:    9760522200232
LU WWN Device Id: 0 000000 000000000
Firmware Version: VG01A00W
User Capacity:    256,060,514,304 bytes [256 GB]
Sector Size:      512 bytes logical/physical
Rotation Rate:    Solid State Device
Form Factor:      2.5 inches
TRIM Command:     Available, deterministic
Device is:        Not in smartctl database 7.5/5706
ATA Version is:   ACS-3, ATA8-ACS T13/1699-D revision 6
SATA Version is:  SATA 3.0, 6.0 Gb/s (current: 6.0 Gb/s)
Local Time is:    Fri Aug 14 19:34:22 2026 EDT
SMART support is: Available - device has SMART capability.
SMART support is: Enabled
AAM feature is:   Unavailable
APM feature is:   Unavailable
Rd look-ahead is: Disabled
Write cache is:   Enabled
DSN feature is:   Unavailable
ATA Security is:  Disabled, frozen [SEC2]

=== START OF READ SMART DATA SECTION ===
SMART overall-health self-assessment test result: PASSED

General SMART Values:
Offline data collection status:  (0x00)	Offline data collection activity
					was never started.
					Auto Offline Data Collection: Disabled.
Self-test execution status:      (   0)	The previous self-test routine completed
					without error or no self-test has ever 
					been run.
Total time to complete Offline 
data collection: 		(    1) seconds.
Offline data collection
capabilities: 			 (0x59) SMART execute Offline immediate.
					No Auto Offline data collection support.
					Suspend Offline collection upon new
					command.
					Offline surface scan supported.
					Self-test supported.
					No Conveyance Self-test supported.
					Selective Self-test supported.
SMART capabilities:            (0x0002)	Does not save SMART data before
					entering power-saving mode.
					Supports SMART auto save timer.
Error logging capability:        (0x01)	Error logging supported.
					General Purpose Logging supported.
Short self-test routine 
recommended polling time: 	 (   1) minutes.
Extended self-test routine
recommended polling time: 	 (   2) minutes.

SMART Attributes Data Structure revision number: 10
Vendor Specific SMART Attributes with Thresholds:
ID# ATTRIBUTE_NAME          FLAGS    VALUE WORST THRESH FAIL RAW_VALUE
  1 Raw_Read_Error_Rate     POSR-K   100   100   050    -    0
  5 Reallocated_Sector_Ct   PO--CK   100   100   010    -    0
  9 Power_On_Hours          -O--CK   100   100   000    -    2
 12 Power_Cycle_Count       -O--CK   100   100   000    -    2
161 Unknown_Attribute       -O--CK   100   100   050    -    0
162 Unknown_Attribute       -O--CK   100   100   000    -    0
163 Unknown_Attribute       -O--CK   100   100   000    -    3000
164 Unknown_Attribute       -O--CK   100   100   000    -    0
166 Unknown_Attribute       -O--CK   100   100   000    -    174
167 Unknown_Attribute       -O--CK   100   100   000    -    0
168 Unknown_Attribute       -O--CK   100   100   000    -    0
169 Unknown_Attribute       -O--CK   100   100   000    -    100
171 Unknown_Attribute       -O--CK   100   100   000    -    0
172 Unknown_Attribute       -O--CK   100   100   000    -    0
174 Unknown_Attribute       -O--CK   100   100   000    -    1
175 Program_Fail_Count_Chip -O--CK   100   100   000    -    0
187 Reported_Uncorrect      -O--CK   100   100   000    -    0
194 Temperature_Celsius     -O---K   100   100   000    -    39
195 Hardware_ECC_Recovered  -O-RCK   100   100   000    -    0
196 Reallocated_Event_Count -O--CK   100   100   000    -    0
199 UDMA_CRC_Error_Count    -O--CK   100   100   000    -    0
206 Unknown_SSD_Attribute   -O--CK   100   100   000    -    0
207 Unknown_SSD_Attribute   -O--CK   100   100   000    -    0
232 Available_Reservd_Space -O--CK   100   100   000    -    100
241 Total_LBAs_Written      -O--CK   100   100   000    -    0
242 Total_LBAs_Read         -O--CK   100   100   000    -    0
249 Unknown_Attribute       -O--CK   100   100   000    -    0
250 Read_Error_Retry_Rate   -O--CK   100   100   000    -    0
                            ||||||_ K auto-keep
                            |||||__ C event count
                            ||||___ R error rate
                            |||____ S speed/performance
                            ||_____ O updated online
                            |______ P prefailure warning

General Purpose Log Directory Version 1
SMART           Log Directory Version 1 [multi-sector log support]
Address    Access  R/W   Size  Description
0x00       GPL,SL  R/O      1  Log Directory
0x01           SL  R/O      1  Summary SMART error log
0x02           SL  R/O      1  Comprehensive SMART error log
0x03       GPL     R/O      2  Ext. Comprehensive SMART error log
0x04       GPL,SL  R/O      5  Device Statistics log
0x06           SL  R/O      1  SMART self-test log
0x07       GPL     R/O      1  Extended self-test log
0x09           SL  R/W      1  Selective self-test log
0x10       GPL     R/O      1  NCQ Command Error log
0x11       GPL     R/O      1  SATA Phy Event Counters log
0x30       GPL,SL  R/O      8  IDENTIFY DEVICE data log
0x80-0x9f  GPL,SL  R/W     16  Host vendor specific log
0xe0       GPL,SL  R/W      1  SCT Command/Status
0xe1       GPL,SL  R/W      1  SCT Data Transfer

SMART Extended Comprehensive Error Log Version: 1 (2 sectors)
No Errors Logged

SMART Extended Self-test Log Version: 1 (1 sectors)
Num  Test_Description    Status                  Remaining  LifeTime(hours)  LBA_of_first_error
# 1  Short offline       Completed without error       00%         2         -

SMART Selective self-test log data structure revision number 0
Note: revision number not 1 implies that no selective self-test has ever been run
 SPAN  MIN_LBA  MAX_LBA  CURRENT_TEST_STATUS
    1        0        0  Not_testing
    2        0        0  Not_testing
    3        0        0  Not_testing
    4        0        0  Not_testing
    5        0        0  Not_testing
Selective self-test flags (0x0):
  After scanning selected spans, do NOT read-scan remainder of disk.
If Selective self-test is pending on power-up, resume after 0 minute delay.

SCT Commands not supported

Device Statistics (GP Log 0x04)
Page  Offset Size        Value Flags Description
0x01  =====  =               =  ===  == General Statistics (rev 1) ==
0x01  0x008  4               2  ---  Lifetime Power-On Resets
0x01  0x010  4               2  ---  Power-on Hours
0x01  0x018  6               0  ---  Logical Sectors Written
0x01  0x020  6               0  ---  Number of Write Commands
0x01  0x028  6           13530  ---  Logical Sectors Read
0x01  0x030  6             400  ---  Number of Read Commands
0x01  0x038  6            5587  ---  Date and Time TimeStamp
0x04  =====  =               =  ===  == General Errors Statistics (rev 1) ==
0x04  0x008  4               0  ---  Number of Reported Uncorrectable Errors
0x04  0x010  4               0  ---  Resets Between Cmd Acceptance and Completion
0x06  =====  =               =  ===  == Transport Statistics (rev 1) ==
0x06  0x008  4               3  ---  Number of Hardware Resets
0x06  0x018  4               0  ---  Number of Interface CRC Errors
0x07  =====  =               =  ===  == Solid State Device Statistics (rev 1) ==
0x07  0x008  1               0  ---  Percentage Used Endurance Indicator
                                |||_ C monitored condition met
                                ||__ D supports DSN
                                |___ N normalized value

Pending Defects log (GP Log 0x0c) not supported

SATA Phy Event Counters (GP Log 0x11)
ID      Size     Value  Description
0x0001  4            0  Command failed due to ICRC error
0x000a  4            3  Device-to-host register FISes sent due to a COMRESET

### /dev/disk/by-id/ata-P3-256_9760511210658
DEVTYPE=disk
ID_MODEL=P3-256
ID_SERIAL=P3-256_9760511210658
smartctl 7.5 2025-04-30 r5714 [x86_64-linux-7.0.14-8-pve] (local build)
Copyright (C) 2002-25, Bruce Allen, Christian Franke, www.smartmontools.org

=== START OF INFORMATION SECTION ===
Device Model:     P3-256
Serial Number:    9760511210658
LU WWN Device Id: 0 000000 000000000
Firmware Version: ACEC29B2
User Capacity:    256,060,514,304 bytes [256 GB]
Sector Size:      512 bytes logical/physical
Rotation Rate:    Solid State Device
Form Factor:      2.5 inches
TRIM Command:     Available, deterministic, zeroed
Device is:        Not in smartctl database 7.5/5706
ATA Version is:   ACS-4 T13/BSR INCITS 529 revision 5
SATA Version is:  SATA 3.2, 6.0 Gb/s (current: 6.0 Gb/s)
Local Time is:    Fri Aug 14 19:34:22 2026 EDT
SMART support is: Available - device has SMART capability.
SMART support is: Enabled
AAM feature is:   Unavailable
APM feature is:   Unavailable
Rd look-ahead is: Disabled
Write cache is:   Enabled
DSN feature is:   Unavailable
ATA Security is:  Disabled, frozen [SEC2]

=== START OF READ SMART DATA SECTION ===
SMART overall-health self-assessment test result: PASSED

General SMART Values:
Offline data collection status:  (0x02)	Offline data collection activity
					was completed without error.
					Auto Offline Data Collection: Disabled.
Self-test execution status:      (   0)	The previous self-test routine completed
					without error or no self-test has ever 
					been run.
Total time to complete Offline 
data collection: 		(   52) seconds.
Offline data collection
capabilities: 			 (0x1d) SMART execute Offline immediate.
					No Auto Offline data collection support.
					Abort Offline collection upon new
					command.
					Offline surface scan supported.
					Self-test supported.
					No Conveyance Self-test supported.
					No Selective Self-test supported.
SMART capabilities:            (0x0002)	Does not save SMART data before
					entering power-saving mode.
					Supports SMART auto save timer.
Error logging capability:        (0x01)	Error logging supported.
					General Purpose Logging supported.
Short self-test routine 
recommended polling time: 	 (   4) minutes.
Extended self-test routine
recommended polling time: 	 (   8) minutes.

SMART Attributes Data Structure revision number: 1
Vendor Specific SMART Attributes with Thresholds:
ID# ATTRIBUTE_NAME          FLAGS    VALUE WORST THRESH FAIL RAW_VALUE
  1 Raw_Read_Error_Rate     -O--CK   100   100   050    -    0
  5 Reallocated_Sector_Ct   -O--CK   100   100   050    -    0
  9 Power_On_Hours          -O--CK   100   100   050    -    339
 12 Power_Cycle_Count       -O--CK   100   100   050    -    37
160 Unknown_Attribute       -O--CK   100   100   050    -    0
161 Unknown_Attribute       -O--CK   100   100   050    -    100
163 Unknown_Attribute       -O--CK   100   100   050    -    1968
164 Unknown_Attribute       -O--CK   100   100   050    -    99
165 Unknown_Attribute       -O--CK   100   100   050    -    55
166 Unknown_Attribute       -O--CK   100   100   050    -    0
167 Unknown_Attribute       -O--CK   100   100   050    -    5
168 Unknown_Attribute       -O--CK   100   100   050    -    0
169 Unknown_Attribute       -O--CK   100   100   050    -    100
175 Program_Fail_Count_Chip -O--CK   100   100   050    -    33554432
176 Erase_Fail_Count_Chip   -O--CK   100   100   050    -    8020
177 Wear_Leveling_Count     -O--CK   100   100   050    -    490918
178 Used_Rsvd_Blk_Cnt_Chip  -O--CK   100   100   050    -    1
181 Program_Fail_Cnt_Total  -O--CK   100   100   050    -    0
182 Erase_Fail_Count_Total  -O--CK   100   100   050    -    0
192 Power-Off_Retract_Count -O--CK   100   100   050    -    17
194 Temperature_Celsius     -O--CK   100   100   050    -    38
195 Hardware_ECC_Recovered  -O--CK   100   100   050    -    34
196 Reallocated_Event_Count -O--CK   100   100   050    -    0
197 Current_Pending_Sector  -O--CK   100   100   050    -    0
198 Offline_Uncorrectable   -O--CK   100   100   050    -    0
199 UDMA_CRC_Error_Count    -O--CK   100   100   050    -    0
232 Available_Reservd_Space -O--CK   100   100   050    -    100
241 Total_LBAs_Written      -O--CK   100   100   050    -    12019
242 Total_LBAs_Read         -O--CK   100   100   050    -    135
                            ||||||_ K auto-keep
                            |||||__ C event count
                            ||||___ R error rate
                            |||____ S speed/performance
                            ||_____ O updated online
                            |______ P prefailure warning

General Purpose Log Directory Version 1
SMART           Log Directory Version 1 [multi-sector log support]
Address    Access  R/W   Size  Description
0x00       GPL,SL  R/O      1  Log Directory
0x01       GPL,SL  R/O      1  Summary SMART error log
0x02       GPL,SL  R/O      1  Comprehensive SMART error log
0x03       GPL,SL  R/O      1  Ext. Comprehensive SMART error log
0x04       GPL,SL  R/O      8  Device Statistics log
0x06       GPL,SL  R/O      1  SMART self-test log
0x07       GPL,SL  R/O      1  Extended self-test log
0x09       GPL,SL  R/W      1  Selective self-test log
0x10       GPL,SL  R/O      1  NCQ Command Error log
0x11       GPL,SL  R/O      1  SATA Phy Event Counters log
0x30       GPL,SL  R/O      9  IDENTIFY DEVICE data log
0x80-0x9f  GPL,SL  R/W     16  Host vendor specific log
0xa0       GPL,SL  VS      16  Device vendor specific log
0xe0       GPL,SL  R/W      1  SCT Command/Status
0xe1       GPL,SL  R/W      1  SCT Data Transfer

SMART Extended Comprehensive Error Log Version: 0 (1 sectors)
No Errors Logged

SMART Extended Self-test Log Version: 1 (1 sectors)
Num  Test_Description    Status                  Remaining  LifeTime(hours)  LBA_of_first_error
# 1  Short offline       Completed without error       00%       339         -

Selective Self-tests/Logging not supported

SCT Commands not supported

Device Statistics (GP Log 0x04)
Page  Offset Size        Value Flags Description
0x01  =====  =               =  ===  == General Statistics (rev 1) ==
0x01  0x008  4              37  ---  Lifetime Power-On Resets
0x01  0x010  4             339  ---  Power-on Hours
0x01  0x018  6       787677184  ---  Logical Sectors Written
0x01  0x020  6         5067187  ---  Number of Write Commands
0x01  0x028  6         8847360  ---  Logical Sectors Read
0x01  0x030  6           91113  ---  Number of Read Commands
0x01  =====  =               =  ===  == General Statistics (rev 1) ==
0x01  0x008  4              37  ---  Lifetime Power-On Resets
0x01  0x010  4             339  ---  Power-on Hours
0x01  0x018  6       787677184  ---  Logical Sectors Written
0x01  0x020  6         5067187  ---  Number of Write Commands
0x01  0x028  6         8847360  ---  Logical Sectors Read
0x01  0x030  6           91113  ---  Number of Read Commands
0x01  =====  =               =  ===  == General Statistics (rev 1) ==
0x01  0x008  4              37  ---  Lifetime Power-On Resets
0x01  0x010  4             339  ---  Power-on Hours
0x01  0x018  6       787677184  ---  Logical Sectors Written
0x01  0x020  6         5067187  ---  Number of Write Commands
0x01  0x028  6         8847360  ---  Logical Sectors Read
0x01  0x030  6           91113  ---  Number of Read Commands
0x01  =====  =               =  ===  == General Statistics (rev 1) ==
0x01  0x008  4              37  ---  Lifetime Power-On Resets
0x01  0x010  4             339  ---  Power-on Hours
0x01  0x018  6       787677184  ---  Logical Sectors Written
0x01  0x020  6         5067187  ---  Number of Write Commands
0x01  0x028  6         8847360  ---  Logical Sectors Read
0x01  0x030  6           91113  ---  Number of Read Commands
0x01  =====  =               =  ===  == General Statistics (rev 1) ==
0x01  0x008  4              37  ---  Lifetime Power-On Resets
0x01  0x010  4             339  ---  Power-on Hours
0x01  0x018  6       787677184  ---  Logical Sectors Written
0x01  0x020  6         5067187  ---  Number of Write Commands
0x01  0x028  6         8847360  ---  Logical Sectors Read
0x01  0x030  6           91113  ---  Number of Read Commands
0x01  =====  =               =  ===  == General Statistics (rev 1) ==
0x01  0x008  4              37  ---  Lifetime Power-On Resets
0x01  0x010  4             339  ---  Power-on Hours
0x01  0x018  6       787677184  ---  Logical Sectors Written
0x01  0x020  6         5067187  ---  Number of Write Commands
0x01  0x028  6         8847360  ---  Logical Sectors Read
0x01  0x030  6           91113  ---  Number of Read Commands
0x01  =====  =               =  ===  == General Statistics (rev 1) ==
0x01  0x008  4              37  ---  Lifetime Power-On Resets
0x01  0x010  4             339  ---  Power-on Hours
0x01  0x018  6       787677184  ---  Logical Sectors Written
0x01  0x020  6         5067187  ---  Number of Write Commands
0x01  0x028  6         8847360  ---  Logical Sectors Read
0x01  0x030  6           91113  ---  Number of Read Commands
0x01  =====  =               =  ===  == General Statistics (rev 1) ==
0x01  0x008  4              37  ---  Lifetime Power-On Resets
0x01  0x010  4             339  ---  Power-on Hours
0x01  0x018  6       787677184  ---  Logical Sectors Written
0x01  0x020  6         5067187  ---  Number of Write Commands
0x01  0x028  6         8847360  ---  Logical Sectors Read
0x01  0x030  6           91113  ---  Number of Read Commands
                                |||_ C monitored condition met
                                ||__ D supports DSN
                                |___ N normalized value

Pending Defects log (GP Log 0x0c) not supported

SATA Phy Event Counters (GP Log 0x11)
ID      Size     Value  Description
0x0001  2            0  Command failed due to ICRC error
0x0009  2          143  Transition from drive PhyRdy to drive PhyNRdy
0x000a  2           71  Device-to-host register FISes sent due to a COMRESET
0x000b  2            0  CRC errors within host-to-device FIS
0x000d  2            0  Non-CRC errors within host-to-device FIS

